2025-03-04 07:18:13 - 
=== PROJECT STATEMENT ===
2025-03-04 07:18:13 - ---
description: About this project
globs:
---
# About this project

`twat-fs` is a file system utility library focused on robust and extensible file upload capabilities with multiple provider support. It provides:

- Multi-provider upload system with smart fallback (catbox.moe default, plus Dropbox, S3, etc.)
- Automatic retry for temporary failures, fallback for permanent ones
- URL validation and clean developer experience with type hints
- Simple CLI: `python -m twat_fs upload_file path/to/file.txt`
- Easy installation: `uv pip install twat-fs` (basic) or `uv pip install 'twat-fs[all,dev]'` (all features)

## Development Notes
- Uses `uv` for Python package management
- Quality tools: ruff, mypy, pytest
- Clear provider protocol for adding new storage backends
- Strong typing and runtime checks throughout

2025-03-04 07:18:13 - 
=== Current Status ===
2025-03-04 07:18:13 - [1.1K]  .
├── [  64]  .benchmarks
├── [  96]  .cursor
│   └── [ 224]  rules
│       ├── [ 821]  0project.mdc
│       ├── [ 516]  cleanup.mdc
│       ├── [3.4K]  filetree.mdc
│       └── [2.0K]  quality.mdc
├── [  96]  .github
│   └── [ 128]  workflows
│       ├── [2.7K]  push.yml
│       └── [1.4K]  release.yml
├── [3.6K]  .gitignore
├── [ 470]  .pre-commit-config.yaml
├── [  96]  .specstory
│   └── [ 800]  history
│       ├── [2.7K]  .what-is-this.md
│       ├── [302K]  2025-03-04_03-25-codebase-analysis-and-todo-md-update.md
│       ├── [ 80K]  2025-03-04_05-35-implementation-of-todo-phases-1,-2,-3.md
│       ├── [115K]  2025-03-04_08-00-project-maintenance-and-documentation-update.md
│       ├── [ 35K]  caching-strategies-for-twat-cache-library.md
│       ├── [ 54K]  codebase-improvement-and-dependency-management-plan.md
│       ├── [124K]  documentation-update-and-task-management.md
│       ├── [217K]  implementing-todo-item.md
│       ├── [ 44K]  merging-files-from-wrong-location.md
│       ├── [238K]  project-documentation-and-command-execution.md
│       ├── [135K]  project-overview-and-todo-execution.md
│       ├── [ 13K]  project-review-and-implementation.md
│       ├── [142K]  project-setup-and-implementation-steps.md
│       ├── [162K]  project-setup-and-task-implementation.md
│       ├── [ 56K]  project-setup-and-task-management.md
│       ├── [ 53K]  refactoring-plan-for-twat-cache-system.md
│       ├── [173K]  refining-decorators-and-integration-goals-1.md
│       ├── [282K]  refining-decorators-and-integration-goals.md
│       ├── [ 95K]  running-lint-fix-command.md
│       ├── [ 11K]  todo-list-update-and-progress-logging.md
│       ├── [170K]  update-todo-and-log-for-project.md
│       ├── [182K]  updating-todo-and-running-development-commands.md
│       └── [260K]  updating-todos-and-project-documentation.md
├── [5.9K]  CHANGELOG.md
├── [ 939]  CLEANUP.txt
├── [1.0K]  LICENSE
├── [ 19K]  LOG.md
├── [7.7K]  NEXT.md
├── [1.2K]  PROMPT.txt
├── [ 38K]  README.md
├── [377K]  REPO_CONTENT.txt
├── [5.3K]  TODO.md
├── [   7]  VERSION.txt
├── [ 13K]  cleanup.py
├── [ 160]  dist
├── [  96]  docs
│   └── [7.7K]  context_management.md
├── [  96]  examples
│   └── [6.9K]  backend_selection.py
├── [1.5K]  pyproject.toml
├── [ 160]  src
├── [ 576]  tests
│   ├── [  67]  __init__.py
│   ├── [ 13K]  test_backend_selector.py
│   ├── [ 13K]  test_cache.py
│   ├── [3.3K]  test_config.py
│   ├── [2.0K]  test_constants.py
│   ├── [6.0K]  test_context.py
│   ├── [2.5K]  test_context_simple.py
│   ├── [ 12K]  test_decorators.py
│   ├── [4.3K]  test_engines.py
│   ├── [6.9K]  test_exceptions.py
│   ├── [2.8K]  test_exceptions_simple.py
│   ├── [6.3K]  test_fallback.py
│   ├── [9.5K]  test_redis_cache.py
│   └── [7.6K]  test_twat_cache.py
├── [188K]  twat_search.txt
└── [ 90K]  uv.lock

13 directories, 61 files

2025-03-04 07:18:13 - 
Project structure:
2025-03-04 07:18:13 - [1.1K]  .
├── [  64]  .benchmarks
├── [  96]  .cursor
│   └── [ 224]  rules
│       ├── [ 821]  0project.mdc
│       ├── [ 516]  cleanup.mdc
│       ├── [3.4K]  filetree.mdc
│       └── [2.0K]  quality.mdc
├── [  96]  .github
│   └── [ 128]  workflows
│       ├── [2.7K]  push.yml
│       └── [1.4K]  release.yml
├── [3.6K]  .gitignore
├── [ 470]  .pre-commit-config.yaml
├── [  96]  .specstory
│   └── [ 800]  history
│       ├── [2.7K]  .what-is-this.md
│       ├── [302K]  2025-03-04_03-25-codebase-analysis-and-todo-md-update.md
│       ├── [ 80K]  2025-03-04_05-35-implementation-of-todo-phases-1,-2,-3.md
│       ├── [115K]  2025-03-04_08-00-project-maintenance-and-documentation-update.md
│       ├── [ 35K]  caching-strategies-for-twat-cache-library.md
│       ├── [ 54K]  codebase-improvement-and-dependency-management-plan.md
│       ├── [124K]  documentation-update-and-task-management.md
│       ├── [217K]  implementing-todo-item.md
│       ├── [ 44K]  merging-files-from-wrong-location.md
│       ├── [238K]  project-documentation-and-command-execution.md
│       ├── [135K]  project-overview-and-todo-execution.md
│       ├── [ 13K]  project-review-and-implementation.md
│       ├── [142K]  project-setup-and-implementation-steps.md
│       ├── [162K]  project-setup-and-task-implementation.md
│       ├── [ 56K]  project-setup-and-task-management.md
│       ├── [ 53K]  refactoring-plan-for-twat-cache-system.md
│       ├── [173K]  refining-decorators-and-integration-goals-1.md
│       ├── [282K]  refining-decorators-and-integration-goals.md
│       ├── [ 95K]  running-lint-fix-command.md
│       ├── [ 11K]  todo-list-update-and-progress-logging.md
│       ├── [170K]  update-todo-and-log-for-project.md
│       ├── [182K]  updating-todo-and-running-development-commands.md
│       └── [260K]  updating-todos-and-project-documentation.md
├── [5.9K]  CHANGELOG.md
├── [ 939]  CLEANUP.txt
├── [1.0K]  LICENSE
├── [ 19K]  LOG.md
├── [7.7K]  NEXT.md
├── [1.2K]  PROMPT.txt
├── [ 38K]  README.md
├── [377K]  REPO_CONTENT.txt
├── [5.3K]  TODO.md
├── [   7]  VERSION.txt
├── [ 13K]  cleanup.py
├── [ 160]  dist
├── [  96]  docs
│   └── [7.7K]  context_management.md
├── [  96]  examples
│   └── [6.9K]  backend_selection.py
├── [1.5K]  pyproject.toml
├── [ 160]  src
├── [ 576]  tests
│   ├── [  67]  __init__.py
│   ├── [ 13K]  test_backend_selector.py
│   ├── [ 13K]  test_cache.py
│   ├── [3.3K]  test_config.py
│   ├── [2.0K]  test_constants.py
│   ├── [6.0K]  test_context.py
│   ├── [2.5K]  test_context_simple.py
│   ├── [ 12K]  test_decorators.py
│   ├── [4.3K]  test_engines.py
│   ├── [6.9K]  test_exceptions.py
│   ├── [2.8K]  test_exceptions_simple.py
│   ├── [6.3K]  test_fallback.py
│   ├── [9.5K]  test_redis_cache.py
│   └── [7.6K]  test_twat_cache.py
├── [188K]  twat_search.txt
└── [ 90K]  uv.lock

13 directories, 61 files

2025-03-04 07:18:13 - On branch main
Your branch is up to date with 'origin/main'.

Changes not staged for commit:
  (use "git add <file>..." to update what will be committed)
  (use "git restore <file>..." to discard changes in working directory)
	modified:   .cursor/rules/filetree.mdc
	modified:   .pre-commit-config.yaml
	modified:   CHANGELOG.md
	modified:   CLEANUP.txt
	modified:   TODO.md
	modified:   cleanup.py
	modified:   twat_search.txt

Untracked files:
  (use "git add <file>..." to include in what will be committed)
	.specstory/history/2025-03-04_08-00-project-maintenance-and-documentation-update.md
	REPO_CONTENT.txt

no changes added to commit (use "git add" and/or "git commit -a")

2025-03-04 07:18:13 - On branch main
Your branch is up to date with 'origin/main'.

Changes not staged for commit:
  (use "git add <file>..." to update what will be committed)
  (use "git restore <file>..." to discard changes in working directory)
	modified:   .cursor/rules/filetree.mdc
	modified:   .pre-commit-config.yaml
	modified:   CHANGELOG.md
	modified:   CLEANUP.txt
	modified:   TODO.md
	modified:   cleanup.py
	modified:   twat_search.txt

Untracked files:
  (use "git add <file>..." to include in what will be committed)
	.specstory/history/2025-03-04_08-00-project-maintenance-and-documentation-update.md
	REPO_CONTENT.txt

no changes added to commit (use "git add" and/or "git commit -a")

2025-03-04 07:18:13 - 
=== Environment Status ===
2025-03-04 07:18:13 - Setting up virtual environment
2025-03-04 07:18:14 - Virtual environment created and activated
2025-03-04 07:18:14 - Installing package with all extras
2025-03-04 07:18:14 - Setting up virtual environment
2025-03-04 07:18:15 - Virtual environment created and activated
2025-03-04 07:18:16 - Package installed successfully
2025-03-04 07:18:16 - Running code quality checks
2025-03-04 07:18:16 - >>> Running code fixes...
2025-03-04 07:18:16 - >>>Running type checks...
2025-03-04 07:18:16 - >>> Running tests...
2025-03-04 07:18:16 - All checks completed
2025-03-04 07:18:16 - 
=== TODO.md ===
2025-03-04 07:18:16 - ---
this_file: TODO.md
---

# twat-cache TODO List

## High Priority

- [ ] Implement a consistent logging strategy across all modules
  - Add structured logging with configurable verbosity levels
  - Implement log rotation for persistent logs
  - Add performance metrics logging
- [ ] Improve code documentation with better docstrings
  - Add detailed parameter descriptions
  - Include return value documentation
  - Document exceptions that can be raised
  - Add usage examples in docstrings
- [ ] Add more defensive programming with better input validation
  - Validate function arguments more thoroughly
  - Add type checking for critical parameters
  - Implement graceful fallbacks for invalid inputs
- [ ] Refactor complex functions in decorators.py to improve readability
  - Break down large functions into smaller, focused ones
  - Improve naming for better self-documentation
  - Add explanatory comments for complex logic
- [ ] Increase overall test coverage to 90%
  - Add more unit tests for edge cases
  - Implement integration tests for all backends
  - Add performance regression tests

## Medium Priority

- [ ] Add support for asynchronous cache operations in all engines
  - Implement async versions of all cache operations
  - Add async context managers
  - Ensure compatibility with asyncio event loops
- [ ] Implement a unified configuration system with environment variable support
  - Add support for loading config from environment variables
  - Create a configuration hierarchy (env vars > config files > defaults)
  - Add validation for configuration values
- [ ] Create a more intuitive API for cache management operations
  - Simplify the interface for common operations
  - Add helper functions for frequent use cases
  - Improve error messages and feedback
- [ ] Add decorator factories with more customizable options
  - Support for custom key generation functions
  - Add options for cache invalidation strategies
  - Implement conditional caching based on arguments
- [ ] Create simpler API for cache statistics and monitoring
  - Add hit/miss ratio tracking
  - Implement cache efficiency metrics
  - Add visualization tools for cache performance

## Performance Optimizations

- [ ] Optimize key generation for better performance
  - Implement faster hashing algorithms for keys
  - Add support for custom key generation functions
  - Optimize key storage and lookup
- [ ] Implement smart TTL handling with refreshing strategies
  - Add background refresh for frequently accessed items
  - Implement sliding TTL windows
  - Add support for TTL based on access patterns
- [ ] Add memory usage monitoring to prevent cache bloat
  - Implement memory usage tracking
  - Add automatic pruning based on memory pressure
  - Create alerts for excessive memory usage
- [ ] Optimize serialization/deserialization for common data types
  - Add specialized serializers for numpy arrays and pandas DataFrames
  - Implement compression for large objects
  - Add support for incremental serialization

## Compatibility and Integration

- [ ] Ensure compatibility with Python 3.12+
  - Test with latest Python versions
  - Update type hints to use latest typing features
  - Address any deprecation warnings
- [ ] Add support for integration with popular frameworks
  - Create adapters for Flask, FastAPI, Django
  - Add middleware for web frameworks
  - Implement integration examples
- [ ] Ensure compatibility with container environments
  - Test in Docker and Kubernetes environments
  - Add configuration for containerized deployments
  - Document best practices for containers

## Documentation and Examples

- [ ] Create a comprehensive API reference with examples
  - Document all public classes and functions
  - Add usage examples for each feature
  - Include performance considerations
- [ ] Add doctest examples in function docstrings
  - Add executable examples in docstrings
  - Ensure examples are tested in CI
  - Keep examples up-to-date with API changes
- [ ] Create tutorials for advanced use cases
  - Add step-by-step guides for common scenarios
  - Create examples for complex configurations
  - Document performance optimization strategies

## Completed Items

- [x] Implement a strategy for choosing the right cache backend for the right type of data
- [x] Implement proper exception handling with custom exception types
- [x] Implement a context manager interface for temporary cache configurations
- [x] Add unit tests for exception handling and context management
- [x] Write and execute a comprehensive test suite for backend selection strategy
- [x] Resolve type compatibility issues in context.py with CacheConfig protocol
- [x] Expand test coverage for cache engines
- [x] Create documentation for cache context management
- [x] Implement Redis cache engine with proper connection handling
- [x] Address linter errors in engine implementations
- [x] Add comprehensive type hints validation with mypy
- [x] Add logging for basic cache operations (hits, misses)
- [x] Improve configuration validation
- [x] Refactor common patterns across engine implementations
- [x] Standardize engine initialization and validation procedures
- [x] Create a unified interface for all cache backends
- [x] Add support for distributed caching with Redis backend
- [x] Add examples in README.md for common use cases
- [x] Implement hybrid caching with automatic backend switching
- [x] Add enhanced context management utilities
2025-03-04 07:18:16 -  M .cursor/rules/filetree.mdc
 M .pre-commit-config.yaml
 M CHANGELOG.md
 M CLEANUP.txt
 M TODO.md
 M cleanup.py
 M twat_search.txt
?? .specstory/history/2025-03-04_08-00-project-maintenance-and-documentation-update.md
?? REPO_CONTENT.txt

2025-03-04 07:18:16 - Changes detected in repository
2025-03-04 07:18:17 - [main ae04b60] Update repository files
 9 files changed, 13397 insertions(+), 226 deletions(-)
 create mode 100644 .specstory/history/2025-03-04_08-00-project-maintenance-and-documentation-update.md
 create mode 100644 REPO_CONTENT.txt

2025-03-04 07:18:17 - Changes committed successfully
2025-03-04 07:18:25 - 
📦 Repomix v0.2.29

No custom config found at repomix.config.json or global config at /Users/adam/.config/repomix/repomix.config.json.
You can add a config file for additional settings. Please check https://github.com/yamadashy/repomix for more information.
⠙ Searching for files...
[2K[1A[2K[G⠹ Searching for files...
[2K[1A[2K[G⠸ Collecting files...
[2K[1A[2K[G⠼ Collecting files...
[2K[1A[2K[G⠴ Collecting files...
[2K[1A[2K[G⠦ Collecting files...
[2K[1A[2K[G⠧ Collecting files...
[2K[1A[2K[G⠇ Collecting files...
[2K[1A[2K[G Collecting files...
[2K[1A[2K[G⠋ Collect file... (2/63) .cursor/rules/cleanup.mdc
[2K[1A[2K[G⠙ Collect file... (30/63) src/twat_cache/decorators.py
[2K[1A[2K[G⠹ Collect file... (61/63) TODO.md
[2K[1A[2K[G⠸ Collect file... (62/63) twat_search.txt
[2K[1A[2K[G⠼ Running security check...
[2K[1A[2K[G⠴ Running security check...
[2K[1A[2K[G⠦ Running security check... (37/63) tests/__init__.py
[2K[1A[2K[G⠧ Processing files...
[2K[1A[2K[G⠇ Processing files...
[2K[1A[2K[G Processing files...
[2K[1A[2K[G⠋ Processing files...
[2K[1A[2K[G⠙ Processing files...
[2K[1A[2K[G⠹ Processing files...
[2K[1A[2K[G⠸ Processing file... (7/63) docs/context_management.md
[2K[1A[2K[G⠼ Processing file... (7/63) docs/context_management.md
[2K[1A[2K[G⠴ Processing file... (9/63) src/twat_cache/engines/__init__.py
[2K[1A[2K[G⠦ Processing file... (15/63) src/twat_cache/engines/diskcache.py
[2K[1A[2K[G⠧ Processing file... (25/63) src/twat_cache/__main__.py
[2K[1A[2K[G⠇ Processing file... (37/63) tests/__init__.py
[2K[1A[2K[G Processing file... (53/63) CHANGELOG.md
[2K[1A[2K[G⠋ Calculating metrics...
[2K[1A[2K[G⠙ Calculating metrics...
[2K[1A[2K[G⠹ Calculating metrics...
[2K[1A[2K[G⠸ Calculating metrics...
[2K[1A[2K[G⠼ Calculating metrics...
[2K[1A[2K[G⠴ Calculating metrics...
[2K[1A[2K[G⠦ Calculating metrics...
[2K[1A[2K[G⠧ Calculating metrics...
[2K[1A[2K[G⠇ Calculating metrics...
[2K[1A[2K[G Calculating metrics...
[2K[1A[2K[G⠋ Calculating metrics...
[2K[1A[2K[G⠙ Calculating metrics...
[2K[1A[2K[G⠹ Calculating metrics...
[2K[1A[2K[G⠸ Calculating metrics...
[2K[1A[2K[G⠼ Calculating metrics...
[2K[1A[2K[G⠴ Calculating metrics...
[2K[1A[2K[G⠦ Calculating metrics...
[2K[1A[2K[G⠧ Calculating metrics...
[2K[1A[2K[G⠇ Calculating metrics...
[2K[1A[2K[G Calculating metrics...
[2K[1A[2K[G⠋ Calculating metrics...
[2K[1A[2K[G⠙ Calculating metrics...
[2K[1A[2K[G⠹ Calculating metrics...
[2K[1A[2K[G⠸ Calculating metrics...
[2K[1A[2K[G⠼ Calculating metrics...
[2K[1A[2K[G⠴ Calculating metrics...
[2K[1A[2K[G⠦ Calculating metrics...
[2K[1A[2K[G⠧ Calculating metrics...
[2K[1A[2K[G⠇ Calculating metrics...
[2K[1A[2K[G Calculating metrics...
[2K[1A[2K[G⠋ Calculating metrics... (3/63) .cursor/rules/filetree.mdc
[2K[1A[2K[G⠙ Calculating metrics... (31/63) src/twat_cache/exceptions.py
[2K[1A[2K[G⠹ Calculating metrics... (47/63) tests/test_exceptions.py
[2K[1A[2K[G⠸ Calculating metrics... (47/63) tests/test_exceptions.py
[2K[1A[2K[G⠼ Calculating metrics... (50/63) tests/test_twat_cache.py
[2K[1A[2K[G⠴ Calculating metrics... (55/63) LICENSE
[2K[1A[2K[G⠦ Calculating metrics... (59/63) pyproject.toml
[2K[1A[2K[G⠧ Calculating metrics... (59/63) pyproject.toml
[2K[1A[2K[G⠇ Calculating metrics... (61/63) TODO.md
[2K[1A[2K[G Calculating metrics... (61/63) TODO.md
[2K[1A[2K[G⠋ Calculating metrics... (61/63) TODO.md
[2K[1A[2K[G⠙ Calculating metrics... (61/63) TODO.md
[2K[1A[2K[G⠹ Calculating metrics... (61/63) TODO.md
[2K[1A[2K[G⠸ Calculating metrics... (61/63) TODO.md
[2K[1A[2K[G⠼ Calculating metrics... (61/63) TODO.md
[2K[1A[2K[G⠴ Calculating metrics... (61/63) TODO.md
[2K[1A[2K[G⠦ Calculating metrics... (63/63) VERSION.txt
[2K[1A[2K[G✔ Packing completed successfully!

📈 Top 5 Files by Character Count and Token Count:
──────────────────────────────────────────────────
1.  twat_search.txt (191,516 chars, 46,304 tokens)
2.  README.md (38,440 chars, 9,794 tokens)
3.  LOG.md (19,617 chars, 4,761 tokens)
4.  NEXT.md (7,869 chars, 1,723 tokens)
5.  docs/context_management.md (7,852 chars, 1,676 tokens)

 Security Check:
──────────────────
✔ No suspicious files detected.

📊 Pack Summary:
────────────────
  Total Files: 63 files
  Total Chars: 385,286 chars
 Total Tokens: 93,063 tokens
       Output: REPO_CONTENT.txt
     Security: ✔ No suspicious files detected

 All Done!
Your repository has been successfully packed.

💡 Repomix is now available in your browser! Try it at https://repomix.com

2025-03-04 07:18:25 - Repository content mixed into REPO_CONTENT.txt
